{
  "meta": {
    "version": "seed-v2-ten-cards-top3",
    "built_at": "2026-09-21",
    "scenario": "evt_seed_003（红磡—会展过海段关闭，大围—九龙塘段拥挤 capacity_factor 0.9）",
    "od": {
      "origin": "TAW",
      "destination": "ADM",
      "depart_at": "2026-09-22T08:20:00+08:00",
      "service_day": "weekday"
    },
    "purpose": "同OD同事件10张物理路径不同的普通simulated示例；严格多样性公开查询仅9，轮椅因无障碍unknown无结果，未满足轮椅top3。",
    "candidate_count_target": 10,
    "included_here": 10,
    "diversity_note": "数量10不等于10个独立替代走廊；候选来自未放宽硬约束的原图搜索，普通全局多样性不变。",
    "provenance": "simulated"
  },
  "routes": [
    {
      "route_id": "r_da67c274e39e0c00",
      "label": "ERL + KTL + TWL",
      "legs": [
        {
          "mode": "MTR",
          "from": "TAW",
          "to": "KOT",
          "depart": "2026-09-22T08:20:00+08:00",
          "arrive": "2026-09-22T08:24:30+08:00",
          "headway_s": 200.0,
          "in_vehicle_s": 270.0,
          "walk_m": 0,
          "fare_hkd": 12.5,
          "accessible": true,
          "provenance": "simulated",
          "line": "ERL",
          "evidence": [
            {
              "source": "contracts/seed/network.seed.json",
              "sha256": "872a408a00aaa2eb1710e43b47ba3366cf0c26794a86023e76bb81ade7d5516c",
              "fields": [
                "mode",
                "line",
                "from",
                "to",
                "headway_s",
                "in_vehicle_s",
                "walk_m",
                "accessible"
              ],
              "status": "simulated-engine-computation-not-official-verification"
            },
            {
              "source": "backend/app/engine/fixtures/seed_policy.json",
              "fields": [
                "fare_hkd"
              ],
              "status": "simulated-fare-policy"
            }
          ]
        },
        {
          "mode": "MTR",
          "from": "KOT",
          "to": "YMT",
          "depart": "2026-09-22T08:25:00+08:00",
          "arrive": "2026-09-22T08:34:00+08:00",
          "headway_s": 120.0,
          "in_vehicle_s": 540.0,
          "walk_m": 0,
          "fare_hkd": 0.0,
          "accessible": true,
          "provenance": "simulated",
          "line": "KTL",
          "evidence": [
            {
              "source": "contracts/seed/network.seed.json",
              "sha256": "872a408a00aaa2eb1710e43b47ba3366cf0c26794a86023e76bb81ade7d5516c",
              "fields": [
                "mode",
                "line",
                "from",
                "to",
                "headway_s",
                "in_vehicle_s",
                "walk_m",
                "accessible"
              ],
              "status": "simulated-engine-computation-not-official-verification"
            },
            {
              "source": "backend/app/engine/fixtures/seed_policy.json",
              "fields": [
                "fare_hkd"
              ],
              "status": "simulated-fare-policy"
            }
          ]
        },
        {
          "mode": "MTR",
          "from": "YMT",
          "to": "ADM",
          "depart": "2026-09-22T08:34:00+08:00",
          "arrive": "2026-09-22T08:44:00+08:00",
          "headway_s": 120.0,
          "in_vehicle_s": 600.0,
          "walk_m": 0,
          "fare_hkd": 0.0,
          "accessible": true,
          "provenance": "simulated",
          "line": "TWL",
          "evidence": [
            {
              "source": "contracts/seed/network.seed.json",
              "sha256": "872a408a00aaa2eb1710e43b47ba3366cf0c26794a86023e76bb81ade7d5516c",
              "fields": [
                "mode",
                "line",
                "from",
                "to",
                "headway_s",
                "in_vehicle_s",
                "walk_m",
                "accessible"
              ],
              "status": "simulated-engine-computation-not-official-verification"
            },
            {
              "source": "backend/app/engine/fixtures/seed_policy.json",
              "fields": [
                "fare_hkd"
              ],
              "status": "simulated-fare-policy"
            }
          ]
        }
      ],
      "total": {
        "time_s": 1440.0,
        "time_range_s": [
          1352.7340668856855,
          1527.2659331143145
        ],
        "transfers": 2,
        "walk_m": 0,
        "fare_hkd": 12.5,
        "co2_g": 377.6459250773652,
        "reliability": 0.9527124634696297,
        "freshness_s": 117540.0
      },
      "score": 0.7253817690399843,
      "score_breakdown": [
        {
          "criterion": "time",
          "raw": 1440.0,
          "normalized": 1.0,
          "weight": 0.45,
          "contribution": 0.45
        },
        {
          "criterion": "transfers",
          "raw": 2,
          "normalized": 0.3333333333333333,
          "weight": 0.1,
          "contribution": 0.03333333333333333
        },
        {
          "criterion": "walk",
          "raw": 0,
          "normalized": 1.0,
          "weight": 0.1,
          "contribution": 0.1
        },
        {
          "criterion": "price",
          "raw": 12.5,
          "normalized": 0.0,
          "weight": 0.1,
          "contribution": 0.0
        },
        {
          "criterion": "comfort",
          "raw": 0.31268409057227237,
          "normalized": 0.31268409057227237,
          "weight": 0.05,
          "contribution": 0.01563420452861362
        },
        {
          "criterion": "reliability",
          "raw": 0.9527124634696297,
          "normalized": 0.9527124634696297,
          "weight": 0.1,
          "contribution": 0.09527124634696298
        },
        {
          "criterion": "carbon",
          "raw": 377.6459250773652,
          "normalized": 0.6185274397991531,
          "weight": 0.05,
          "contribution": 0.03092637198995766
        },
        {
          "criterion": "freshness",
          "raw": 117540.0,
          "normalized": 0.004332256822334126,
          "weight": 0.05,
          "contribution": 0.0002166128411167063
        }
      ],
      "load_estimate": {
        "expected_wait_s": 100.0,
        "load_factor": 0,
        "users_on_route": 0,
        "capacity_per_hour": 43528.5,
        "board_refusal_prob": 0
      },
      "warnings": [
        "种子票价/区间上界/缺省票价为模拟假设，待 C-Data 核验",
        "ERL 数据较旧",
        "ERL 受事件影响，运力系数 0.9",
        "KTL 数据较旧",
        "TWL 数据较旧",
        "碳排放、舒适度和 ETA 方差采用模拟系数；距离使用节点直线距离推算",
        "负载来自显式模拟场景，不代表真实客流",
        "轮椅 M0 演示默认假设 MTR/大巴可用、小巴不可用；无官方无障碍核验，仍须遵守个人步行上限"
      ],
      "notes": [
        "可达性按轮椅 M0 模式默认假设展示，尚未官方核验"
      ],
      "explain": "ERL + KTL + TWL：约 23–25 分钟，换乘 2 次，步行 0 米。按 fastest 权重计算；碳排放与舒适度为模拟估算。",
      "evidence": [
        {
          "source": "ERL",
          "freshness_s": 116400.0
        },
        {
          "source": "KTL",
          "freshness_s": 116700.0
        },
        {
          "source": "KTL",
          "freshness_s": 116940.0
        },
        {
          "source": "KTL",
          "freshness_s": 117090.0
        },
        {
          "source": "TWL",
          "freshness_s": 117240.0
        },
        {
          "source": "TWL",
          "freshness_s": 117390.0
        },
        {
          "source": "TWL",
          "freshness_s": 117540.0
        },
        {
          "event_id": "evt_seed_003",
          "used": true
        },
        {
          "source": "route_model_v1",
          "freshness_s": 0
        },
        {
          "source": "c_route_zero_demand_fixture",
          "freshness_s": 0
        },
        {
          "source": "contracts/seed/network.seed.json",
          "sha256": "872a408a00aaa2eb1710e43b47ba3366cf0c26794a86023e76bb81ade7d5516c",
          "freshness_s": 117540.0
        },
        {
          "source": "contracts/seed/event.seed.json",
          "sha256": "38e20c86959d25eaacd3b7df04f97462effd8e86e276387447c9e692bf79168c",
          "freshness_s": 117540.0
        }
      ],
      "provenance": "simulated"
    },
    {
      "route_id": "r_8232b6602c377cc6",
      "label": "ERL + TML + KTL + TWL",
      "legs": [
        {
          "mode": "MTR",
          "from": "TAW",
          "to": "HUH",
          "depart": "2026-09-22T08:20:00+08:00",
          "arrive": "2026-09-22T08:30:45+08:00",
          "headway_s": 200.0,
          "in_vehicle_s": 645.0,
          "walk_m": 0,
          "fare_hkd": 12.5,
          "accessible": false,
          "provenance": "simulated",
          "line": "ERL",
          "evidence": [
            {
              "source": "contracts/seed/network.seed.json",
              "sha256": "872a408a00aaa2eb1710e43b47ba3366cf0c26794a86023e76bb81ade7d5516c",
              "fields": [
                "mode",
                "line",
                "from",
                "to",
                "headway_s",
                "in_vehicle_s",
                "walk_m",
                "accessible"
              ],
              "status": "simulated-engine-computation-not-official-verification"
            },
            {
              "source": "backend/app/engine/fixtures/seed_policy.json",
              "fields": [
                "fare_hkd"
              ],
              "status": "simulated-fare-policy"
            }
          ]
        },
        {
          "mode": "MTR",
          "from": "HUH",
          "to": "HOM",
          "depart": "2026-09-22T08:31:00+08:00",
          "arrive": "2026-09-22T08:34:00+08:00",
          "headway_s": 180.0,
          "in_vehicle_s": 180.0,
          "walk_m": 0,
          "fare_hkd": 0,
          "accessible": false,
          "provenance": "simulated",
          "line": "TML",
          "evidence": [
            {
              "source": "contracts/seed/network.seed.json",
              "sha256": "872a408a00aaa2eb1710e43b47ba3366cf0c26794a86023e76bb81ade7d5516c",
              "fields": [
                "mode",
                "line",
                "from",
                "to",